{
  "id": "550e8400-e29b-41d4-a716-446655440002",
  "title": "Weekly standup",
  "start": "2026-01-20T09:00:00Z",
  "end": "2026-01-20T10:00:00Z",
  "recurrence": "FREQ=WEEKLY;BYDAY=MO",
  "attendees": [
    "alice@example.com",
    "bob@example.com"
  ],
  "location": "Conference Room A",
  "description": "Weekly team sync-up",
  "source": "test",
  "source_id": "test-event-001",
  "extensions": {
    "com.google.calendar": {
      "hangout_link": "https://meet.google.com/abc-defg-hij"
    }
  },
  "created_at": "2026-01-15T10:30:00Z",
  "updated_at": "2026-01-15T10:30:00Z"
}
